{
  "$schema": "https://mep.entreprise.fr/api/charte/schema.json",
  "version": 1,
  "nom": "Groupe Horizon",
  "couleurs": {
    "primaire": "#0F766E",
    "secondaire": "#1B2A41",
    "tertiaire": "#C026D3"
  },
  "menuLateral": "secondaire",
  "gris": "teintes",
  "sombre": {
    "primaire": "#129187",
    "secondaire": "#162132",
    "tertiaire": "#CA3CDC"
  },
  "etats": {
    "succes": "#15803D"
  }
}
